محمدحسین_برزگر,"Mohammad Hosein Barzegar 
(d. 2009)",A post-2009 Protester who was shot and killed,"Political
",Invalid Site
محسن_روح‌الامینی,Mohsen Rouhallamini (d. 2009),"A post-2009 Green Movement Protester who was arrested, beaten, and later died as a result although the regime argues it was medical reasons","Political
",Invalid Site
آرش_حجازی,Arash Hejazi,"During the 2009 protest, Arash Hejazi tried to revive Neda Aghasoltan on the streets of Tehran. He now lives outside of Iran out of fear of what he knows from that day. ","Political
",Invalid Site
﻿جان‌باختگان_اعتراضات_به_نتایج_انتخابات_دهم_ریاست_جمهوری_ایران,Victims of 2009 election protests,A breakdown and list of the daily events and victims throughout the moments of the 2009 Green Movement,"Political
",Invalid Site
پوکر,Poker,Gambling card game,Profane (non-Sexual),Invalid Site
رزیدنت_ایول_گایدن,Resident Evil: Gaiden,A first person fighting video game a part of the Resident Evil series,Profane (non-sexual),Invalid Keyword
جزيرهٔ_گوزو,Gozo Island,An island south of Sicily in the Mediterranean Sea,Profane (non-sexual),Invalid Keyword
چل,Half-witted,Insult,Profane (non-sexual),Invalid Site
آنفو,ANFO,A combination of ammonium nitrate and gasoline or oil used primarily for used for explosives,profane (non-sexual),Invalid Site
خودکشی,Suicide,The act of willfully taking one's own life leading to death,Profane (non-sexual),Invalid Site
روش‌های_خودکشی,Suicide options,A list of ways an individual can kill themselves,Profane (non-sexual),Invalid Site
وفا_سلطان,Wafa Sultan,Syrian critic of Islam,Religious,Invalid Site
ویکتور_استنجر,Victor Stenger,"Physicist, author, philosophy, and religious skeptic.  ",Religious,Invalid Site
مانیفست_بیخدا,Atheist Manifesto,A book by French philosopher Michel Onfray,Religious,Invalid Site
کریستوفر_هیچنز,Christopher Hitchens,Writer and atheist,Religious,Invalid Site
قوری_چای_راسل,Russell's teapot,A theory arguing against God,Religious,Invalid Site
پت_کاندل,Pat Condell,Atheist and anti-Islam public figure.,Religious,Invalid Site
فاضل_لنکرانی,Fazel Lankarani (d. 2007),"A student of Tabatabai & Khomeini, and a Grand Ayatollah in Qom",Religious,Invalid Site
چارلز_میسون_ریمی,Mason Remey,Prominent Baha'i,Religious,Invalid Site
مونا_محمودنژاد,Mona Mahmudnizhad,Baha'i execution victim,Religious,Invalid Site
اسلام:_آنچه_که_غرب_باید_بداند,Islam: What the West Needs to Know,A documentary that depicts Islam as an inherently violent institution,Religious,Invalid Site
هیولای_اسپاگتی_پرنده,Flying Spaghetti Monster,Group with satirical comment on religion  ,Religious,Invalid Site
پایان_ایمان,The End of Faith,Book strongly criticizing organized religion ,Religious,Invalid Site
فراخوان_کامل_به_بهشت_بیان,The Complete Call To The Heaven Of The Bayan,A book by August Stenstrand on the works of Muhammad Alahry which discusses the Bahai faith,Religious,Invalid Site
چرا_مسلمان_نیستم,Why I Am Not a Muslim,"
A book criticising Islam, in part a response to the Salman Rushdie affair
",Religious,Invalid Site
کمپین_بیرون,Out campaign,Atheist group associated with Richard Dawkinings ,Religious,Invalid Site
مهدی_دیباج,Mehdi Dibaj,Christian convert and pastor murdered in the 1990s,Religious,Invalid Site
هایک_هوسپیان‌مهر,Haik Hovsepian Mehr,Outspoken protestant pastor who was murdered in 1994 ,Religious,Invalid Site
ولید_شویبات,Walid Shoebat,"Public Palestine Christian convert, pro-Israel",Religious,Invalid Site
هنر_زندگی_متعالی_(ماهنامه),Art of the sublime life (monthly),A monthly publication on psychology and sociology that had its license revoked. Its editors were informally today that it was partly for publishing materials that were influenced by the parapsychology Peyman Fatahi.    ,Religious,Invalid Site
نورعلی_تابنده,Nour Ali Tabandeh,Dervish leader,Religious,Invalid Site
ژن_خودخواه,The Selfish Gene,A book on evolution by Richard Dawkins,Religious,Invalid Site
فهرست_آثار_چاپی_ریچارد_داوکینز,Richard Dawkins bibliography,--------------,Religious,Invalid Site
فنوتیپ_گسترش_یافته,The Extended Phenotype,A book by Richard Dawkins discussing the environment and genes through science,Religious,Invalid Site
کمپین_یادآوری_امام_نقی_به_شیعیان,The Campaign to Remind Shiites about Imam Naghi,"Satirical facebook page, mocking Shia Islam and the Islamic Republic",Religious,Invalid Site
پیمان_فتاحی,Peyman Fattahi,Iranian Elyasin spiritual community  founder and leader,Religious,Invalid Site
محمدعلی_طاهری,Mohammad Ali Taheri,Spiritual leader / teacher,Religious,Invalid Site
والنتین_(گنوسی),Valentinus (Gnostic),Second century agnostic Christian theologian,Religious,Invalid Site
نشانه‌های_بهائی,(Baha'i) Symbols of faith,--------------,Religious,Invalid Site
نقد_آثار_سید_علی‌محمد_باب,Critique of Seyyed Mohammad Ali Bab works,Its a wikipedia page on a critique of Bab's work,Religious,Invalid Site
مظهر_ظهور,Manifestation,The term used in Baha'i religion to describe prophets,Religious,Invalid Site
ندانم‌گرایی,Agnosticism,--------------,Religious,Invalid Site
کاروان_اسلام,Caravan of Islam,Sadegh Hedayat book in which he criticize and make fun of clerics,Religious,Invalid Site
جنجال_کاریکاتورهای_محمد_در_یولاندز_پستن,Controversial cartoons of Prophet Muhammad (PBUH),A Danish newspaper published derogatory cartoons of the Prophet in 2005 which sparked outrage by Muslims,Religious,Invalid Site
نقد_علی_ابن_ابی‌طالب,Criticism of Ali Ibn abi Talib,--------------,Religious,Invalid Site
نقد_محمد,Criticism of Muhammad,--------------,Religious,Invalid Site
نقد_قرآن,Criticism of the Quran,--------------,Religious,Invalid Site
احسان_جامی,Ehsan Jami,An Iranian-Dutch politician who denounced his faith in Islam due to the 9/11 attacks,Religious,Invalid Site
خیرت_ویلدرس,Geert Wilders,A Dutch politician who allowed the showing of an anti-Islamic film that drew anger and death threats from the Muslim community,Religious,Invalid Site
بی‌گناهی_مسلمانان,Innocent Muslims,The 2012 film where Prophet Muhammad (PBUH) was shown in a negative light sparking numerous protests by Muslims,Religious,Invalid Site
خرافات_وفور_در_زیارات_قبور,Superstitions about the Ziarat Graves,A book arguing against the Shi community and their reverence for certain shrines,Religious,Invalid Site
تسلیمه_نسرین,Taslima Nasrin,"A Bangladeshi doctor, writer, and feminist who criticizes Islam on its gender rules",Religious,Invalid Site
دین_تقلیدی,Parody religion,A form of mockery towards organized religion such as Shi Islam and the Quran,Religious,Invalid Site
موبد_شیطان,A Devil's Chaplain,A collection of Richard Dawkin's essays,Religious,Invalid Site
بی‌خدایی,Atheism,The belief that God or a God does not exist,Religious,Invalid Site
آیان_حرصی_علی,Ayaan Hirsi Ali,A political activist who denounced her faith to Islam and has published and spoke against Islam,Religious,Invalid Site
شکستن_طلسم,Breaking the Spell,"A book by Daniel Dennett, an American philosopher, who uses science to explain religion as a natural phenomenon",Religious,Invalid Site
صعود_به_قله_ناممکن,Climbing Mount Improbable,"A book by Richard Dawkins about evolution, natural selection, and the like",Religious,Invalid Site
دنیل_دنت,Daniel Dennett,A philosopher who is an atheist,Religious,Invalid Site
داوکینز_دربرابر_گولد,Dawkins vs. Gould,A book by Kim Sterelny presenting the different views of Dawkins and Gould,Religious,Invalid Site
خدا_بزرگ_نیست,God is Not Great,A book by Christopher Hitchens where he argues that religion has ruined everything,Religious,Invalid Site
خدا:_فرضیه_شکست‌خورده,God: The Failed Hypothesis,A book by physicist Victor Stenger who argues that the existence of God is improbable,Religious,Invalid Site
براهین_ناسازگاری_صفات_الهی,God's nonexistence,A line of arguments claiming that God doesn't exist,Religious,Invalid Site
اسب_تک‌شاخ_صورتی_نامرئی,Invisible pink unicorn,A concept used by atheist as a parable to the nonexistence of God,Religious,Invalid Site
لاورنس_کراوس,Lawrence Krauss,A physicist who argues against intelligent design,Religious,Invalid Site
بی‌خدایی_نو,Neo-atheism,The belief that God or a God does not exist,Religious,Invalid Site
برهان_اراده_آزاد,Proof of free will,Another claim arguing the non-existence of God,Religious,Invalid Site
ریچارد_داوکینز,Richard Dawkins,"A science professor at Oxford University whose works and beliefs are anti-religion, anti-God, and specifically anti-Islam",Religious,Invalid Site
رودخانه‌ای_از_بهشت,River Out Of Eden,A book by Richard Dawkins that discusses Darwinism and evolution through science,Religious,Invalid Site
سم_هریس,Sam Harris,"An American author and supporter of scientific skepticism where he argues against religion, especially Islam",Religious,Invalid Site
داستان_نیاکان,The Ancestor's Tale,A book by Richard Dawkins that discusses the evolution of man and animals,Religious,Invalid Site
نوارهای_بی‌خدایی,The Atheism Tapes,Television series on BBC about atheism,Religious,Invalid Site
ساعت‌ساز_نابینا,The Blind Watchmaker,A book by Richard Dawkins describing his views on evolution and science in order to disclaim the existence of God,Religious,Invalid Site
﻿پندار_خدا,The God Delusion,Book discussing scientific arguments for atheism by Richard Dawkins,Religious,Invalid Site
خدای_حفره‌ها,The God gap,A lengthy look into arguments that God does not exist,Religious,Invalid Site
بیخدای_همراه,The Portable Atheist (book),"A 2007 book by Christopher Hitchens where he compiled the works of great thinkers and their view on religion and God
",Religious,Invalid Site
ریشه_همه_شر؟,The Root of All Evil?,A documentary by Richard Dawkins that discusses a better world without religion and God,Religious,Invalid Site
یک_دین‌یار_شیطان,A Devil's Chaplin,Selected essays by Richard Dawkins,Religious,Invalid Site
گشایش_بوئینگ_۷۴۷_غایی,The ultimate boeing 747 gambit,"The Ultimate Boeing 747 gambit is a counter-argument to modern versions of paley-style arguments from design. It was introduced by Richard Dawkins in chapter 4 of his 2006 book The God Delusion, ""Why there almost certainly is no God"".",Religious,Invalid Site
گسیختن_رنگین‌کمان,Unweaving the Rainbow,"Unweaving the Rainbow is a 1998 book by Richard Dawkins, discussing the relationship between science and the arts from the perspective of a scientist.",Religious,Invalid Site
نظم_اداری,(Baha'i) Administrative Order,The Baha'i administrative system,Religious,Invalid Site
مشرق‌الاذکار,(Bahá'í) House of Worship,--------------,Religious,Invalid Site
عبدالبهاء,Abdulbaha (d. ?),"The eldest son of the founder of the Bahai faith, Bahaullah",Religious,Invalid Site
علی‌محمد_ورقا,"Ali Muhammad Vargha 
(d. 2007)",A professor and strong follower of the Bahai faith,Religious,Invalid Site
بهائی‌ستیزی,Anti-Bahai,The series of events of how Bahai's have been persecuted,Religious,Invalid Site
حواریون_بهاءالله,Apostles of Bahaullah,A list of the early followers of Bahaullah,Religious,Invalid Site
گاهشماری_بهائی,Baha'i calender ,"The Bahá'í calendar, also called the Badí‘ calendar, used by Bábism and the Bahá'í faith, is a solar calendar with regular years of 365 days, and leap years of 366 days.",Religious,Invalid Site
نماز_بهائی,Bahá'í prayers,--------------,Religious,Invalid Site
وحدت_لسان_و_خط,Baha'i unity language,Baha'i teaching that the world should adopt a single share auxiliary language,Religious,Invalid Site
بهائیت,Bahai,A monotheistic religion originating in Shiraz,Religious,Invalid Site
شاخه‌های_بهائیت,Bahai branches,A brief description of the structural makeup of the Bahai faith and some of its teachings,Religious,Invalid Site
ادبیات_بهائی,Bahai literature,A list of material including holy and educational books,Religious,Invalid Site
ازدواج_بهائی,Bahai marriage,An explanation of the rules and understandings of a Bahai marriage,Religious,Invalid Site
تعالیم_بهائی,Bahai teachings,A breakdown of the teachings of the Bahai faith,Religious,Invalid Site
حظیرةالقدس,Bahai temple,A palace in Tehran use by Bahai's during the Pahlavi era until it was taken over by the Islamic Republic,Religious,Invalid Site
متون_بهائی,Bahai texts,A list of Bahai literature,Religious,Invalid Site
بهاءالله,Bahaullah,The founder of the Bahai religion,Religious,Invalid Site
کتاب_عهدی,Book of Ahdi,Important Baha'i holy book,Religious,Invalid Site
کتاب_اقدس,Book of Aqdas,Important Baha'i holy book,Religious,Invalid Site
کتاب_بیان,Book of Bayan,Important Baha'i holy book,Religious,Invalid Site
ایادی_امرالله,Cause of faith in Bahai faith,A historical look at how the founding fathers of the Bahai faith found their faith,Religious,Invalid Site
تطابق_علم_و_دین,Compatibility of science and religion,One of the social teachings of the Bahai Faith that discuss how these two disciplines are compatible,Religious,Invalid Site
فاروق_فرساد,Farooq Farsad (d. 1996),"A Suni from Kurdistan who was discriminated, imprisoned, and a victim of the chain murders",Religious,Invalid Site
دانشگاه_علمی_آزاد,Free Scientific University,Also known as Bahai Institute for Higher Education was a school that Bahais use to attend until they were banned,Religious,Invalid Site
کلمات_مبارکه_مکنونه,Hidden Words,A Baha'i holy text,Religious,Invalid Site
جمشید_معانی,Jamshed Maani,A Bahai who claimed to be the successor of the faith and a prophet,Religious,Invalid Site
حروف_حی,Living letters,This phrase refers to the first 18 Bahai followers and the letters they wrote,Religious,Invalid Site
مشرق‌الاذکار_نیلوفر_آبی,Lotus Temple,Baha'i temple in New Dehli,Religious,Invalid Site
رساله_مدنیه,Madnyh Book,A work of manuscripts by Bahaullah and Abdulbaha of the Bahai faith,Religious,Invalid Site
مارثا_روت,Martha Root (d. 1939),A well known member of the Bahai faith,Religious,Invalid Site
میرزا_اسدالله_خویی,Mirza Assadollah Khouei,"Was one of the followers of the Bayan book, which is one of the principal scriptural writings of the Báb, the founder of Bábi religion ",Religious,Invalid Site
بدیع_نیشابوری,Mirza Nishabori (d. 1869),A follower of the Bob,Religious,Invalid Site
من_یظهره‌الله,Proclaim god,A belief among followers of Babi about the conditions and time for the return ,Religious,Invalid Site
رساله_سؤال_و_جواب,Question & answer booklet,A holy book within the Bahai faith where Bahaullah response to certain issues,Religious,Invalid Site
عید_رضوان,Revan Holiday,Twelve Baha'i holiday,Religious,Invalid Site
تجدید_ادیان_در_بهائیت,Revival of the Bahai faith,A social teaching stressing the need for spiritual growth,Religious,Invalid Site
صبح_ازل,Sabeh Azal (d. 1912),The successor of the Bob,Religious,Invalid Site
تساوی_حقوق_زن_و_مرد_در_دیانت_بهائی,Sexual equality in the Bahai faith,One of the teachings of the Bahai faith that men and women are equal on all levels,Religious,Invalid Site
شوقی_افندی,Shoghi Efendi (d. 1957),A former chief guardian of the Bahai community,Religious,Invalid Site
آرامگاه_بهاءالله,Shrine of Bahaullah,The location where the Bahaullah is buried,Religious,Invalid Site
مقام_اعلی,Shrine of the Báb,Baha'i holy site,Religious,Invalid Site
محفل_روحانی,Spiritual Assembly,A nine person group of Bahai clergymen in charge of the spiritual consciousness of the Bahai community,Religious,Invalid Site
محفل_روحانی_ایران,Spiritual Assembly of Iran,Iranian Baha'i leadership,Religious,Invalid Site
آیین_بیانی,Statement of faith,A detailed explanation of the rules and beliefs of the Bahai Faith,Religious,Invalid Site
سید_علی_محمد_باب,"Syed Ali Mohammad Bab 
(d. 1850)",A biography about the man who founded what would soon become the Bahai Faith,Religious,Invalid Site
طاهره_قرةالعین,Tahere Qartalehen (d. 1890),One of the first disciples of the Bahai faith,Religious,Invalid Site
قرةالعین,Tahere Qartalehen (d. 1890),One of the first disciples of the Bahai faith,Religious,Invalid Site
احکام_بابی,Teachings of Babi,A breakdown of what appears to be the main teachings of the Bahai faith,Religious,Invalid Site
هفت_وادی,The Seven Valleys,Baha'i holy book,Religious,Invalid Site
وحدت_عالم_انسانی,Unity of humanity (Baha'i),The Baha'i theological concept,Religious,Invalid Site
بیت‌العدل_اعظم,Universal House of Justice,The highest decision making authority in the Bahai faith whose objective is to preserve the faith,Religious,Invalid Site
ولی_امرالله,Vali Amrollah,Prominent figure in Bahai religion,Religious,Invalid Site
یاران_ایران,Yaran_Iran,Leaders of the Iranian Baha'i community,Religious,Invalid Site
عید_صیام,Lent,Catholic holiday,Religious,Invalid Site
تثلیث,Trinity,"The Christian understanding of God being the Father, the Son, and the Holy Spirit",Religious,Invalid Site
اشو,Osho (d. 1990),A Hindu mystic with what many in the Islamic Republic may see has having a very liberal philosophy on life,Religious,Invalid Site
ساتیا_سای_بابا,Satia Sai Baba,A Hindu spiritual figure who has combined the teachings of Hinduism and Islam,Religious,Invalid Site
امام_حسین,Imam Hussein,"A full biography of the grandchild of Prophet Muhammad (PBUH), 3rd Imam in Shia-Islam, Hussein who was brutally murdered in the month of Muhararm",Religious,Invalid Site
روز_درویش,Day of Dervishes,A sit in protest by Iranian dervishes against the destruction of one of their sacred tombs,Religious,Invalid Site
جواد_نوربخش,Javad Nourbakhsh (d. 2008),"A Sufi, medical doctor, author, and professor of psychiatry at Tehran University",Religious,Invalid Site
ملا_سلطان‌محمد_گنابادی,Molla Soltan Mohammad Gonabadi,Gonabadi Sufi,Religious,Invalid Site
رحمت‌الله_جوادی,Rahmatollah Javadi (d. 2008),A teacher and host to Sufi Dervishes who was attacked by a bulldozer for his beliefs and practices,Religious,Invalid Site
سرکوب_درویش‌های_گنابادی_(۱۳۸۷),The 2009 suppression of Gonabadi Dervishes,On February 18th a holy site of Sufi Dervishes was destroyed - one of many under Ahmadinejad's presidency,Religious,Invalid Site
فرادرمانی,Faradarmani,A holistic and alternative method of medical treatment rooted in mysticism,Religious,Invalid Site
اکنکار,Aknkar,A spiritual practice teaching the capability to reach higher consciousness and gain knowledge of God while on earth,Religious,Invalid Site
مهربابا,Meher Baba,Indian mystic claiming to be the avatar of god,Religious,Invalid Site
نعمت‌الله_مکری_جیحون‌آبادی,Neamatollah Mokri Jeihounabadi,One of the great leaders of Ahl Hagh (Yarsan) in 19th century,Religious,Invalid Site
ملیسا_لورن,Melissa Lauren,Adult film actress,Sex and sexuality,Invalid Site
من_یک_معتاد_به_سکس_هستم_(فیلم),I am a Sex Addict,Independent American documentary film,Sex and sexuality,Invalid Keyword
ویکی_پدیا:ویکی_پروژه_سکس_شناسی,Wikipedia:Wiki project sexology and sexuality,Wiki-discussion group,Sex and sexuality,Invalid Keyword
کاما_سوترا,Kama Sutra,Classical Indian book on sex,Sex and sexuality,Invalid Site
میراندا_کر,Miranda Kerr,Miranda Kerr lingerie model,Sex and sexuality,Invalid Site
پروردگار_ملکه_را_حفظ_کند_(ترانه_سکس_پیستولز),"""God Save the Queen"" ",A single by a punk rock band the Sex Pistols,Sex and sexuality,Invalid Keyword
هیو_هیفنر,Hugh Hefner,Founder of Playboy,Sex and sexuality,Invalid Site
آماندا_لیپوره,Amanda Lepore,Model Amanda Lepore underwent a male to female sex change,Sex and sexuality,Invalid Site
فلسفه_سکس,Philosophy of Sex,--------------,Sex and sexuality,Invalid Keyword
خایه_کشی,Castration,A procedure where the the testicles are removed - a practice performed during the Qajar dynasty,Sex and sexuality,Invalid Keyword
چوچوله,Clitoris,Female sex and sexuality organ,Sex and sexuality,Invalid Keyword
مناطق_شهواني,Erogenous zone,Sexually sensitive part of the body,Sex and sexuality,Invalid Keyword
کیر_انسان,Human penis ,--------------,Sex and sexuality,Invalid Keyword
اندازهٔ_کیر_انسان,Human penis size,An explanation of the conversations on the size of a human penis,Sex and sexuality,Invalid Keyword
سکسی,Nudity,"When an individual does not wear any cloths
",Sex and sexuality,Invalid Keyword
اب_کیر,Semen,An educational understanding of seminal fluid with references from the Holy Quran to pornography,Sex and sexuality,Invalid Keyword
كيسه_خايه,Testicle sack,--------------,Sex and sexuality,Invalid Keyword
عکاسی_شهوانی,Erotic photography,Sexual photography ,Sex and sexuality,Invalid Keyword
سکس_و_فلسفه,Sex and Philosophy,A movie in Russian and Tajik Persian about four different stages of love,Sex and sexuality,Invalid Keyword
بیکینی,Bikini,A female garment worn during occasions of swimming,Sex and sexuality,Invalid Keyword
سوتين,Brassiere,An under garment primarily worn by women to cover and secure their breasts,Sex and sexuality,Invalid Keyword
مونو_بیکینی,Monokini,Was originally a topless women's swimsuit,Sex and sexuality,Invalid Keyword
کونی,Cavnic,City in Romania,Sex and sexuality,Invalid Keyword
خايه_گاو,Cow testicles,"Known by its culinary name, sweetbread",Sex and sexuality,Invalid Keyword
خايه_گوسفند,Sheep testicles,"Known by its culinary name, sweetbread",Sex and sexuality,Invalid Keyword
کیر_مایتلند,Kier Maitland,"Kier Maitland is a male swimmer from Canada, who mostly competes in the distance freestyle events. ",Sex and sexuality,Invalid Keyword
کیر_که_گارد,Kierkegaard,"Søren Aabye Kierkegaard was a Danish philosopher, theologian, poet, social critic, and religious author.",Sex and sexuality,Invalid Keyword
کیری,Kiri,"Name of a cheese, soda, or a form of origami.",Sex and sexuality,Invalid Keyword
کیرش,Kirsch,"Kirsch is a clear, colorless fruit brandy traditionally made from double distillation of morello cherries, a dark-colored cultivar of the sour cherry.",Sex and sexuality,Invalid Keyword
خداوند_ملکه_را_حفظ_کند_(ترانه_سکس_پیستولز),"""God Save the Queen""",A single by a punk rock band Sex Pistols,Sex and sexuality,Invalid Keyword
آتول_بیکینی,Atoll Bikini,"A coral reef of the Marshall Islands, best known for its nuclear test sight in the mid 20th century.",Sex and sexuality,Invalid Keyword
کونی_فن_بنتوم,Conny van Bentum,Olympic swimmer,Sex and sexuality,Invalid Keyword
امانوئل_کونده,Emmanuel Kundi,A former Cameroonian footballer who played on two World Cup teams,Sex and sexuality,Invalid Keyword
فتيش_(روستا),Fetish (village),The name of a geographical location in Yemen,Sex and sexuality,Invalid Keyword
جزیرهٔ_گوزو,Gozo Island,An island south of Sicily in the Mediterranean Sea,Sex and sexuality,Invalid Keyword
جیمز_کیر,James Keir,An English chemist,Sex and sexuality,Invalid Keyword
کسکن,Kaskan,Rural district in Iran,Sex and sexuality,Invalid Keyword
کسکن_قجق,Kaskan Ghajagh,A domed city in the central part of the rural district of Golestan Province in Iran,Sex and sexuality,Invalid Keyword
کیری_(شرکت),Kiri (Company),"Breuvages Kiri, L.P., also known as Technobev S.E.C.. is an independent bottler of soft drinks, water and other non-alcoholic beverages. ",Sex and sexuality,Invalid Keyword
پنیر_کیری,Kiri Cheese,European Cheese,Sex and sexuality,Invalid Keyword
کیری_(پنیر),Kiri Cheese),Kiri is a cheese brand that sells its products in Iran under the name of Kibi. Kir in Farsi mean penis.,Sex and sexuality,Invalid Keyword
کیری_گامی,Kiri_Gami,--------------,Sex and sexuality,Invalid Keyword
کونی_ساکی،_اوئیتا,Kunisaki,Japanese city,Sex and sexuality,Invalid Keyword
ماهسون_کیر_میزیگل,Mahsun Kirmizigol,A Turkish singer and actor,Sex and sexuality,Invalid Keyword
قلعه_قنبل,Nodose Castle,A castle during the first millennium BC that was registered as a national monument in 2005,Sex and sexuality,Invalid Keyword
فرودگاه_آب_سنگ_بیکینی,Reef Bikini Airport,--------------,Sex and sexuality,Invalid Keyword
سکس_پیستولز,Sex Pistols,A punk rock band,Sex and sexuality,Invalid Keyword
استارال_کونيم_کلرايد,Stearalkonium chloride,A chemical compound,Sex and sexuality,Invalid Keyword
اوتاگاوا_کونی_یوشی,Utagawa Kuniyoshi (d. 1861),A famous Japanese artist,Sex and sexuality,Invalid Keyword
