محمدعلی_ابطحی,Mohammad-Ali Abtahi,Former Iranian vice president and political prisoner,Political,Invalid Site
عملکرد_سید_علی_خامنه‌ای_و_سازمان‌های_تابعه,Khamenei's government,A description of how the Islamic Republic has been governed under his rule,Political,Invalid Site
سید_احمد_خاتمی,Syed Ahmad Khatami,"No relation to President Khatami, a strong supporter of the regime and a member of multiple governmental bodies",Political,Invalid Site
آیت_الله_بیات_زنجانی,Ayatollah Bayat Zanjani,"In the wake of the 2009 protests, Zanjani supported the Protesters and subsequently Mousavi",Political,Invalid Site
آیت_الله_صانعی,Ayatollah Sanei,"In the wake of the 2009 protests, Sanei supported the protesters and criticized certain branches of the regime",Political,Invalid Site
هادی_غفاری,Hadi Ghaffari,"Critical cleric, former MP / post-2009",Political,Invalid Site
محمود_امجد,Mahmoud Amjad,Dissident cleric,Political,Invalid Site
سید_علی‌محمد_دستغیب,Syed Ali Mohammad Dastgheib,A cleric and high ranking official within the regime who was critical of the severity of crackdowns during the protests,Political,Invalid Site
حبیب‌الله_آشوری,Habibollah Ashuri (d. 1981),A clergyman and former MKO member who has spoken out against the Shah and the IRI,Political,Invalid Site
سید_حسن_خمینی,Syed Hassan Khomeini,Grandson of Khomeini who has been cautiously critical of certain figures within the regime,Political,Invalid Site
احمد_خمینی,Ahmad Khomeini (d.1994),"Khomeini's second son, whose death is surrounded with controversy to this day",Political,Invalid Site
اکبر_هاشمی_رفسنجانی,Akbar Hashemi Rafsanjani,A former president and prominent political figure within the regime,Political,Invalid Site
آیت_الله_خمینی,Ayatollah Khomeini,The father of the Islamic Republic,Political,Invalid Site
احمد_منتظری,Ahmad Montazeri,"Son of Ayatollah Montazeri, was an activist during the 2009 protest and was arrested",Political,Invalid Site
محمد_خاتمی,Mohammad Khatami,Former president of Iran and member of the reformist camp who has a long history of quarrels with the ruling elite,Political,Invalid Site
محمود_طالقانی,Mahmoud Taleghani,Pro-democracy cleric part of the 1979 revolution. Founder of the Freedom Movement,Political,Invalid Site
حسن_یوسفی_اشکوری,Hasan Yousefi Eshkevari,"A cleric, journalist, and scholar who in 2000 made some blasphemous statements [according to the Islamic Republic]",Political,Invalid Site
محمدتقی_مصباح_یزدی,Mohammad-Taqi Mesbah-Yazdi,Ultra conservative cleric and member of the Assembly of Experts,Political,Invalid Site
سید_علی‌رضا_بهشتی_شیرازی,Syed Alireza Beheshti Shirazi,"A professor, journalist, and politician who advised Mousavi in 2009 and subsequently was arrested ",Political,Invalid Site
علی_فلاحیان,Ali Fallahian,"A representative of the Assembly of Experts, Fallahian has a number of Interpol arrest warrants for crimes against human life",Political,Invalid Site
علی_خامنه‌ای,Ali Khamenei,"A full biography of the second, and current, Supreme Leader of the Islamic Republic of Iran",Political,Invalid Site
صادق_لاریجانی,Sadegh Larijani,From the powerful Larijani family and head of Iran's judiciary,Political,Invalid Site
روح‌الله_حسینیان,Ruhollah Hoseiniyan,A clergyman and judge with a storied career within the Islamic Republic resigned from parliament shortly after Ahmadinejad was reelected,Political,Invalid Site
کاظم_دارابی,Kazem Darabi ,Iranian in Germany convicted of being the leader Mikonos killings in Berlin,Political,Invalid Site
بیژن_فاضلی,Bijan Fazeli (d. 1986),"Son of actor Reza Fazeli, a critic of the Islamic Republic, Bijan was killed due to bomb explosion in his store in London",Political,Invalid Site
رامین_پوراندرجانی,"Ramin Pourandarjani 
(d. 2009)","A medical doctor who treated patients at Kahrizak prison but was brought up on charges of malpracice, and whose own death is shrouded in mystery",Political,Invalid Site
فریبرز_رئیس‌دانا,Fariborz Reisdana,An economist and activist who criticised the regimes handling of the economy on BBC and was arrested upon returning to Iran,Political,Invalid Site
ترور_میکونوس,The Mikonos assassinations,"In 1992 in Berlin, Germany a number of individuals who are in opposition to the IRI were murdered during their meeting at the Mikonos restaurant",Political,Invalid Site
تشییع_عزت‌الله_سحابی,Ezzatollah Sahabi's funeral,The day of Sahabi's funeral a series confrontation occurred between the bereaved and government forces,Political,Invalid Site
پرونده_نشریه‌های_جعلی_دانشگاه_امیرکبیر,The case of fake Amir Kabir University publications,"After Amir Kabir university student protest Ahmadinejad visit in 2007, fake student publications were printed with cartoons of Ayatollah Khamenei, the Basij protested these publications. However, Amir Kabir's Islamic Student Association denied publishing these cartoons and stated that the publication was copied and fake.  Several student were arrested, tortured, and charged for these publications",Political,Invalid Site
مرگ_و_تشییع_حسین‌علی_منتظری,"Hussien Ali Montazeri's death and funeral

",Events around the death of famous dissident Ayatollah,Political,Invalid Site
ژانویه_۲۰۱۰,January 2010,"A wikipedia page on the events on January 2010, including reactions to Mir Hossei Mousavi's statement",Political,Invalid Site
مه_۲۰۱۰,May_2010,"Page on the event of May 2010, including the arrest of IRGC spies in Kuwait, International Labor Day, Ahmad Zeidabadi's description of an interrogation, and Rafsanjani's defense of his Friday prayer speech  ",Political,Invalid Site
نماز_جمعه_تهران_(۲۶_تیر_۱۳۸۸),Tehran Friday Prayer (26 Tir 1388),The first and last Friday prayer of Hashemi Rafsanjani since the 2009 election. ,Political,Invalid Site
اعدام_زندانیان_سیاسی_(تابستان_۱۳۶۷),The 1988 execution of political prisoners,In the summer of 1988 a number of political prisoners were executed on the orders of Khomeini,Political,Invalid Site
محمد_نوری‌زاد,Mohammad Nourizad,"Film maker, former journalist for Kayhan arrested after publicly urging Khamanei to apologize for post-2009 violence",Political,Invalid Site
ماجرای_دستگیری_و_محاکمه_جعفر_پناهی,Jafar Panahi's arrest and trial,"After supporting the 2009 Protesters, Iranian film director Panahi was banned from film-making for 20 years and sentenced to 6 years in prison",Political,Invalid Site
نهضت_آزادی_ایران,Iranian Freedom Movement,Long standing Iranian democratic religious-nationalist political movement/party,Political,Invalid Site
خانهٔ_شیخ_الاسلامی_کسکن,Sheikh Kaskan residence,During the Qajar and Pahlavi era this location housed the Kaskan family,Political,Invalid Keyword
حبس_خانگی_میرحسین_موسوی،_مهدی_کروبی_و_همسرانشان,House arrest of Mousavi & Karroubi,"As a result of the Green Movement, Mousavi and Karroubi were placed on house arrest amidst international opposition",Political,Invalid Site
گورستان_خاوران,Gourestan Khavaran,Khavaran Cemetery is an unmarked mass grave for the 1988 execution of political prisoners ,Political,Invalid Site
حسین_برازنده,Hosein Barazande (d. 1995),An engineer and Quran teacher who was one of the victims of the chain murders,Political,Invalid Site
فریبا_پژوه,Fariba Pejveh,A journalist who participated in the 2009 protests and was imprisoned on charges of espionage and propaganda,Political,Invalid Site
فرج_سرکوهی,Faraj Sarkouhi,"A prominent before the revolution since then he was banned, arrested, and exiled",Political,Invalid Site
اکبر_گنجی,Akbar Ganji,An author and journalist who has spoken out against the chain murders of Iran and the validity of the Quran,Political,Invalid Site
﻿﻿ابراهیم_زال‌زاده,Abraham Zalzadh (d. 1997),A journalist and author who was a victim of the chain murders,Political,Invalid Site
مولود_بهرامیان,Moloud Bahramian ,Kurdish blogger and journalist,Political,Invalid Site
هنگامه_شهیدی,Hengameh Shahidi,Journalist and Karroubi advisor ,Political,Invalid Site
کریم_ارغنده‌پور,Karim_Orghondehpour,Reformist politician and journalist,Political,Invalid Site
عیسی_سحرخیز,Issa Saharkhiz,"Imprisoned journalists, activist ",Political,Invalid Site
هوشنگ_اسدی,Houshang Asadi,Journalist and activist ,Political,Invalid Site
دادگاه_متهمان_حوادث_پس_از_انتخابات_دهم_ریاست_جمهوری_ایران,Trial of the velvet revolution defendants,A mass trial took place in 2009 against the opposition of the Iranian presidential elections,Political,Invalid Site
دادگاه_ویژه_روحانیت,Special Court for the Clergy,A branch of Iran's judiciary that is independent from the constitution and is ran by the Supreme Leader to control the clerical establishment,Political,Invalid Site
تاریک‌خانه_اشباح_(کتاب),Darkhouse Ghosts (book),"Authored by Akbar Ganji, this book discusses how Iran can only improve through democratic growth",Political,Invalid Site
غلامعلی_اویسی,Gholam Ali Aveisi (d. 1984),A desecrated military commander under the Shah who was a victim of the chain murders when in Paris,Political,Invalid Site
راه_سبز_امید,Green Hope,A social networking organization inspired by the Green Movement and dedicated to the implementation of the constitution,Political,Invalid Site
پیام_نوروزی_رهبران_جنبش_سبز_(۱۳۸۹),Green Movement leader's New Year message (1389),--------------,Political,Invalid Site
جنبش_سبز,Green Movement,A series of protests in response and as a result of the 2009 presidential election results,Political,Invalid Site
شعارنویسی_جنبش_سبز,Green Movement chants,A list of all the different chants Protester would say while protesting,Political,Invalid Site
منشور_جنبش_سبز,Green Movement charter,"Mir Hossein Mousavi's statement on the goals,tactics, and the identity of Green Movement   ",Political,Invalid Site
روبان_سبز,Green ribbon,A ribbon symbolizes many things around the world but most recently it represents the Green Movement in Iran,Political,Invalid Site
جنبش_مسلمانان_مبارز,Militant Islamic Movement,A movement in the 1960's and partially after the 2009 elections with a focus on political issues,Political,Invalid Site
اصلاح‌طلبان_ایران,Reformist of Iran,One of the leading opposition parties inside Iran with key members unofficially carrying the Green Movement flag,Political,Invalid Site
فریدون_فرخزاد,Fereydoun Farokhzad (d. 1992),"A famous musician and actor, pre-revolution, who fled to Germany where he was later a victim of the chain murders",Political,Invalid Site
سرود_ملی_اسرائیل,National Anthem of Israel,The national song of Israel with the lyrics provided,Political,Invalid Site
علی‌اکبر_حیدری‌فر,Aliakbar Heidarifar,"A prosecutor whose sent individuals to the Kahrizak detention center and was later arrested on charges of unauthorized use of a weapon, and possession of narcotics",Political,Invalid Site
عزیزالله_رجب‌زاده,Azizollah Rajabzadeh,Head of Crisis Prevention and Management in Tehran and former chief of police whose known for his interrogation tactics and attacks on protesters,Political,Invalid Site
حسین_طائب,Hosein Tayb,"A notorious career as a commander of the Basij, especially his crackdowns during the 2009 protests",Political,Invalid Site
محمدرضا_نقدی,Mohammadreza Naghdi,Commander of the Basij paramilitary force,Political,Invalid Site
مجاهدین_خلق,People's Mojahedin of Iran,A militia and political opposition ,Political,Invalid Site
مریم_فیروز,Mayam Firouz,Member of Tudeh Party and founder of its women organization,Political,Invalid Site
شورای_هماهنگی_راه_سبز_امید,Coordinating Council of the Green Path of Hope,An organization formed by Mousavi in 2009 to coordinate continued protests,Political,Invalid Site
حزب_کمونیست_ایران_(دهه_۱۹۲۰),Communist Party of Iran (1920),A communist party that was active in Iran up until the mid 1920's,Political,Invalid Site
حزب_کمونیست_کارگری_ایران,Workers Communist Party of Iran,A political party with strong positions against the Islamic Republic and more of a focus on the workers,Political,Invalid Site
کانون_نویسندگان_ایران,The writers association of Iran,Association representing writers and promoting free expression,Political,Invalid Site
مجمع_مدرسین_و_محققین_حوزه_علمیه_قم,Assembly of Qom Seminary Teachers and Researchers,A group of reformists,Political,Invalid Site
مجمع_روحانیون_مبارز,Association of Combatant Clergymen,"A political and religious organization consisting of the reformist group, including Karroubi and Khatami",Political,Invalid Site
جبهه_مشارکت,Islamic Iran Participation Front,A political party inside Iran founded in 1998 by Khatami with a reformist philosophy,Political,Invalid Site
سازمان_مجاهدین_انقلاب_اسلامی,Mojahedin of the Islamic Revolution,"Reformist Party
",Political,Invalid Site
شورای_فعالان_ملی-مذهبی_ایران,Nationalist-Religious Coalition of Iran,A group of political activists who advocate similar ideas as the reformist camp,Political,Invalid Site
انصار_حزب‌الله,Ansar-e Hezbollah,A pressure group - similar to the basij - that has helped the Islamic Republic crack down on any oppositional threat,Political,Invalid Site
لباس_شخصی,Plain Cloths,Article about plain cloths semi-official forces like the Basij,Political,Invalid Site
پایگاه_بسیج_مقداد,Basij mobilization base,A temporary location near Azadi Square used to shoot protesters during the 2009 protests,Political,Invalid Site
دفتر_تحکیم_وحدت,Office of Consolidating Unity/Daftar-e Tahkim-e Vahdat,A student organization that has been operating since the revolution and know as a pro-democracy group,Political,Invalid Site
حزب_اعتماد_ملی,National Trust Party,The political party ticket Karroubi ran on in the 2009 Presidential elections,Political,Invalid Site
پیامدهای_اعلام_نتایج_انتخابات_ریاست_جمهوری_ایران_(۱۳۸۸),Implications of the announcement of the 2009 election results,2009-2010 Iranian election protests,Political,Invalid Site
نقد_گفتار_محمود_احمدی‌نژاد,Criticism of Mahmoud Ahmadinejad's speeches,--------------,Political,Invalid Site
دی_۱۳۸۹,January 2011,A break down of top news stories of each day of Iran's calendar month of Dey,Political,Invalid Site
علی_وکیلی‌راد,Ali Vakili Rad,The murderer of Bakhtiar in France who was freed back to Iran after a prisoner exchange,Political,Invalid Site
غلامحسین_محسنی_اژه‌ای,Gholam Hossein Mohseni Ejei,"A politician, cleric, and judge who was involved in the chain murders and had conflicts with Ahmadinejad",Political,Invalid Site
خسرو_براتی,Khorsro Barati,An assassin during the chain murders who killed four people and was later tried and convicted,Political,Invalid Site
مهرداد_عالیخانی,Mehrdad Alikhani,One of the influential figures in the implementation of the chain murders,Political,Invalid Site
مصطفی_کاظمی_(قاتل),Mostafa Kazeim (Murderer),Member of the ministry of intelligence and prime suspect for the serial killings.   ,political,Invalid Site
سعید_امامی,Saeed Imami (d. 1999),A former senior official on Iran's intelligence service who was one of the individuals responsible for the chain murders,Political,Invalid Site
اسماعیل_احمدی‌مقدم,Esmail Ahmadi Moghadam,Chief of Iran's National Police Forces has used excessive measures of suppression throughout his tenure,Political,Invalid Site
علی_شکوری‌راد,Ali Shakuri Rad,Former MP and member of the Islamic Iran Participation Front whose incarceration spurred protests,Political,Invalid Site
علی_تاجرنیا,Ali Tajarnia,Former MP who supported Mousavi in 2009 and was imprisoned as a result and received 74 lashes for insulting Ahmadinejad,Political,Invalid Site
علی_مطهری,Ali Motahari,An MP and a conservative who throughout his career has been critical of certain politicians and argued for a harsher stance against the 2009 protesters,Political,Invalid Site
عبدالعلی_بازرگان,Abdulali Bazargan,A journalist and writer who was critical of the Pahlavi's and the Islamic Republic and has been imprisoned under both regimes,Political,Invalid Site
محسن_سازگارا,Mohsen Sazegara,Former translator for Khomeini and member of the IRGC whose been imprisoned twice for acting against national security,Political,Invalid Site
مجتبی_واحدی,Mojtaba Vahedi,A writer and political reformer who was a senior advisor to Karroubi and a critic of Khamenei,Political,Invalid Site
عبدالله_رمضان_زاده,Abdullah Ramezanzadeh,A professor and politician with a long career within the regime but was imprisoned after the 2009 elections,Political,Invalid Site
علیرضا_بهشتی_شیرازی,Alireza Beheshti Shirazi,"A professor, journalist, and politician who advised Mousavi in 2009 and subsequently was arrested ",Political,Invalid Site
سید_ابراهیم_امینی,Syed Ibrahim Amini,"A professor, lawyer, and politician who supported Karroubi's 2009 campaign and was subsequently arrested as a result",Political,Invalid Site
علی_اکبر_موسوی_خوئینی,Ali Akbar Mousavi Khoiniha,Former MP whose been arrested for protesting for women prisoners and for students,Political,Invalid Site
ابراهیم_یزدی,Ebrahim Yazdi,Political activists who has been critical of the Islamic Republic since the hostage crisis,Political,Invalid Site
علی‌رضا_عاشوری,Alireza Ashuri,A staff member of Mousavi's 2009 campaign who was arrested for participating in rallies and media events,Political,Invalid Site
علی‌رضا_بهشتی,Alireza Beheshti,Senior advisor to Mousavi's 2009 campaign who was arrested after the Ashura protests,Political,Invalid Site
علی‌اکبر_ولایتی,Aliakbar Velayati,An international advisor to Khamenei and a long time supporter of the regime,Political,Invalid Site
علی‌اکبر_طباطبایی,Aliakbar Tabatabai (d. 1980),An AP spokesman for the Iranian Embassy in DC under the Shah who was against the Islamic Republic and was later assassinated in Maryland,Political,Invalid Site
احمد_جنتی,Ahmad Jannati,"Politician with a storied career in the Islamic Republic, Jannati took a harsh, yet conspiratorial stance against the regime in 2009",Political,Invalid Site
علی_لاریجانی,Ali Larijani,From the powerful Larijani family and former Speaker of Parliament,Political,Invalid Site
مجتبی_خامنه‌ای,Mojtaba Khamenei,Son of Khamenei who has been linked to accusations of voter manipulation and embezzlement,Political,Invalid Site
عزت_الله_سحابی,Ezatollah Sahabi (d. 2011),A very active politician and political activist whose was in and out of jail since 1963,Political,Invalid Site
روابط_ایران_و_اسرائیل,Iran - Israel relations,An overview of Iran and Israel's relationship throughout history to the present,Political,Invalid Site
سران_فتنه,"""Leaders""",A term used by the principlists after the 2009 elections as a way to address the leaders of the Green Movement,Political,Invalid Site
اردشیر_امیرارجمند,Ardeshir Amir Arjomand,Mousavi's legal advisor during and after his 2009 Presidential candidacy,Political,Invalid Site
عطاءالله_مهاجرانی,Ataullah Mohajerani,A writer and politician whose held a number of political offices and is associated with the Green Movement,Political,Invalid Site
عبدالرحمن_قاسملو,"Abdulraham Ghasemloo 
(d. 1989)",Secretary General of the Democratic Party of Iranian Kurdistan whose worked mainly focused on the Kurds,Political,Invalid Site
صادق_شرفکندی,Sadegh Sharafkandi (d. 1992),A biography of the General Secretary of the Democratic Party of Iranian Kurdistan,Political,Invalid Site
رضا_پهلوی_(دوم),Reza Pahlavi,The last crown prince of the Pahlavi Dynasty currently residing in America and actively working on issues related to Iran,Political,Invalid Site
شهریار_شفیق,Shahriar Shafiq (d. 1979),A senior Navy officer under the Pahlavi regime,Political,Invalid Site
عبدالرحمن_برومند,"Abdulraham Boroumand 
(d. 1991)",Chairman of the Executive Board of the National Resistance Movement that worked against the Islamic Republic,Political,Invalid Site
مظفر_بقائی,Mozzafar Baghai ,Iranian nationalist political figure,Political,Invalid Site
عفت_مرعشی,Efat Marashi,Wife of Rafsanjani whose dabbled in politics,Political,Invalid Site
ابوالفضل_قدیانی,Abolfazl Ghadiani,"Member of the Mojahedin of the Islamic Revolution Organization, Ghadiani has criticized Khamenei and the regime about 2009",Political,Invalid Site
حمزه_کرمی,Hamzeh Karami,An academic and political advisor under Rafsanjani and Khatami's presidency,Political,Invalid Site
محمدرضا_تاجیک,Mohammad Reza Tajik,A reformer and political activist who was a senior consultant to Mousavi's 2009 campaign,Political,Invalid Site
زهرا_رهنورد,Zahra Rahnavard,"A university president, artist, and activist who has recently supported her husband, Mousavi, throughout the Green Movement",Political,Invalid Site
کاظم_رجوی,Kazem Rajavi,"Former UN Rep, MKO member and brother of Massoud Rajavi ",Political,Invalid Site
محمدرضا_تاجیک,Mohammad-Reza Tajik,"Writer, political thinker, and reformist political activist that served as a campaign advisor for Mir Hossein Mousavi in the 2009 elections.",Political,Invalid Keyword
محسن_امین‌زاده,Mohsen Aminzadeh,Deputy Foreign Minister to Khatami and founding member of the Islamic Iran Participation Front whose been imprisoned from the Green Movement,Political,Invalid Site
میر_حسین_موسوی,Mir-Hossein Mousavi,2009 Candidate and Green Movement leader under house arrest,Political,Invalid Site
فائزه_هاشمی_رفسنجانی,Faezah Hashemi Rafsanjani,"The second daughter of Rafsanjani who is involved in politics, spoke out during the 2009 protests and was arrested",Political,Invalid Site
فیض‌الله_عرب‌سرخی,Feizollah Arabsorkhi,A politician who is incarcerated for protesting after the 2009 elections,Political,Invalid Site
محسن_آرمین,Mohsen Armin,A politician and reformer who was arrested during the 2009 protests,Political,Invalid Site
عبدالله_نوری,Abdullah Nouri,A politician whose held multiple high ranking offices and was outspoken about the chain murders,Political,Invalid Site
کاظم_سامی,Kazem Sami,Former Minister of Health under Bazargan and leader of the Iranian Nation Liberation Movement,Political,Invalid Site
شمس‌الدین_امیرعلائی,Shamsedin Amiralai  (d. 1994),A politician under the Pahlavi regime and a victim of the chain murders,Political,Invalid Site
داوود_سلیمانی,David Solomon,An academic and politician who worked on Mousaiv's campaign team in 2009,Political,Invalid Site
قربانعلی_دری_نجف‌آبادی,Ghorbanali Door Najafabadi,A cleric and high ranking politician who served in Khatami's cabinet but resigned due to connections with the chain murders,Political,Invalid Site
غلام‌علی_حداد_عادل,Gholam Ali Hadad Adel,A top politician within the regime whose held many important offices and currently the president of Parliament and a member of the Expediency Council,Political,Invalid Site
محمود_احمدی‌نژاد,Mahmoud Ahmadinejad,President of Iran (2005-20013),Political,Invalid Site
سعید_مرتضوی,Saeed Mortazavi,--------------,Political,Invalid Site
شاپور_بختیار,Shapour Bakhtiar (d. 1991),A full biography about the last Prime Minister under the Pahlavi Dynasty,Political,Invalid Site
احمد_قدیریان,Ahmad Ghadirian (d. 2012),Executive Deputy Attorney General during the Revolution,Political,Invalid Site
بهزاد_نبوی,Behzad Nabavi,A politician whose been in Mahdavi Kani and Mousavi's cabinet as well as an MP,Political,Invalid Site
محمد_رضا_خاتمی,Mohammad-Reza Khatami,"Brother of ex-president, former MP and former Secretary-General of Islamic Iran Participation ",Political,Invalid Site
عباس_امیرانتظام,Abas Amir-Entezam (d. ?),Deputy PM of Bazargan's interim government before Khomeini took control subsequently leading to Entezam's arrest on charges of spying,Political,Invalid Site
فاطمه_کروبی,Fatemeh Karroubi,Wife of Karroubi but a strong politician in her own right; Secretary General of the Muslim Women's Association,Political,Invalid Site
مصطفی_تاج‌زاده,Mostafa Tajzadeh,Progressive reformist politician,Political,Invalid Site
مرتضی_الویری,Morteza Alviri,"Iranian politician, former Theran mayor. Karroubi campaigner in 2009 and prisoner.",Political,Invalid Site
بازداشتگاه_۲۰۹,209 Detention Center,"A section of Evin prison where prisoners are blindfolded, tortured, and interrogated",Political,Invalid Site
